{
  "id": "11111111-1111-1111-1111-111111111111",
  "project_id": "22222222-2222-2222-2222-222222222222",
  "run_id": "33333333-3333-3333-3333-333333333333",
  "git_commit_sha": "a1b2c3d4e5f60718293a4b5c6d7e8f901a2b3c4d",
  "rollback_point": true,
  "description": "Pre-execution checkpoint before agent file modification",
  "created_at": "2026-10-02T16:00:00Z"
}
